{"aggregate":{"case_count":3,"mean_score":"1.000000","score_sum":"3.000000"},"case_results":[{"case_id":"same-decimal","score":"1.000000"},{"case_id":"integer-and-decimal","score":"1.000000"},{"case_id":"negative-same","score":"1.000000"}],"input_sha256":"6fb720d563e8b08fa0b8f015875f9eff40e7c8d676590b158bae0c32d3dd924c","metadata":{"contract_version":"1.0.0"},"schema_id":"bmas.reference_scorer_result","scorer":"bounded_numeric"}
