{"aggregate":{"case_count":4,"mean_score":"0.437500","score_sum":"1.750000"},"case_results":[{"case_id":"half","score":"0.500000"},{"case_id":"one-third-away","score":"0.666667"},{"case_id":"two-thirds-away","score":"0.333333"},{"case_id":"quarter","score":"0.250000"}],"input_sha256":"7428d7b529e0231dd034c9cc3c0ad68fa7791d68f6399ed738225688f1ea6798","metadata":{"contract_version":"1.0.0"},"schema_id":"bmas.reference_scorer_result","scorer":"bounded_numeric"}
