{"aggregate":{"case_count":5,"mean_score":"0.200000","score_sum":"1.000000"},"case_results":[{"case_id":"matched","score":"1.000000"},{"case_id":"unmatched","score":"0.000000"},{"case_id":"empty-actual","score":"0.000000"},{"case_id":"case-sensitive","score":"0.000000"},{"case_id":"whitespace-strict","score":"0.000000"}],"input_sha256":"720002bd5cad3b1e0fa61df689da2d632b9752a65807da0e5c14a32a968105af","metadata":{"contract_version":"1.0.0"},"schema_id":"bmas.reference_scorer_result","scorer":"exact_match"}
