{"aggregate":{"case_count":3,"mean_score":"1.000000","score_sum":"3.000000"},"case_results":[{"case_id":"greeting","score":"1.000000"},{"case_id":"empty-both","score":"1.000000"},{"case_id":"multiline","score":"1.000000"}],"input_sha256":"9b3fdc151955c4bdaeb8a308e24587314778022b4bd9097cda36fb066241a00c","metadata":{"contract_version":"1.0.0"},"schema_id":"bmas.reference_scorer_result","scorer":"exact_match"}
