{"aggregate":{"case_count":3,"mean_score":"0.666667","score_sum":"2.000000"},"case_results":[{"case_id":"composed-matched","score":"1.000000"},{"case_id":"decomposed-differs","score":"0.000000"},{"case_id":"emoji-matched","score":"1.000000"}],"input_sha256":"a58601ad7f5ff54429d0f1f2ee5a7752418ad073221fbfae0b3676dfaddc17cb","metadata":{"contract_version":"1.0.0"},"schema_id":"bmas.reference_scorer_result","scorer":"exact_match"}
