{"aggregate":{"case_count":4,"mean_score":"0.250000","score_sum":"1.000000"},"case_results":[{"case_id":"just-outside","score":"0.000000"},{"case_id":"far-outside","score":"0.000000"},{"case_id":"huge-magnitudes","score":"0.000000"},{"case_id":"rounds-up-to-one","score":"1.000000"}],"input_sha256":"40da202b1121d9bec96eafb52cf525b3ad154576ebdeae51b183b732ce8dd630","metadata":{"contract_version":"1.0.0"},"schema_id":"bmas.reference_scorer_result","scorer":"bounded_numeric"}
