{"aggregate":{"case_count":4,"mean_score":"0.375000","score_sum":"1.500000"},"case_results":[{"case_id":"decimal-tenths","score":"0.000000"},{"case_id":"banker-rounding","score":"0.500000"},{"case_id":"tiny-values","score":"0.500000"},{"case_id":"large-precise","score":"0.500000"}],"input_sha256":"6390ee88425b02236d4545b4f9aedb06a868d555192abe06a2ce0848baf86993","metadata":{"contract_version":"1.0.0"},"schema_id":"bmas.reference_scorer_result","scorer":"bounded_numeric"}
